{
  "$schema": "https://json-schema.org/draft/2020-12/schema",
  "title": "distribution_message",
  "type": "object",
  "properties": {
    "channel": {
      "type": "string"
    },
    "message_type": {
      "type": "string"
    },
    "title": {
      "type": [
        "string",
        "null"
      ]
    },
    "summary": {
      "type": [
        "string",
        "null"
      ]
    },
    "items": {
      "type": [
        "array",
        "null"
      ]
    },
    "updated_at": {
      "type": "string"
    }
  },
  "required": [
    "channel",
    "message_type",
    "updated_at"
  ]
}