{
  "channel": "telegram",
  "message_type": "market_os_summary",
  "title": "ZeroOne Forge AI交易OS 摘要",
  "summary": "watch 78 / candidate 15 / execution 5 / paper 5",
  "items": {
    "top_execution": [
      "DOGE",
      "BTC",
      "CHIP",
      "SOL",
      "SPK"
    ],
    "top_candidate": [
      "KAS",
      "GENIUS",
      "TRUMP",
      "ZEC",
      "PEPE"
    ],
    "thought_outputs": [
      "DOGE",
      "BTC",
      "CHIP",
      "SOL",
      "SPK",
      "KAS"
    ],
    "paper_execution": [
      "DOGE",
      "BTC",
      "CHIP",
      "SOL",
      "SPK"
    ]
  },
  "updated_at": "2026-04-28T15:03:46Z"
}